{
 "schemaVersion": 0,
 "actorId": "C003",
 "planId": "plan.craft.axe",
 "actionDefId": "action.craft",
 "durationTicks": 120,
 "workPositionMm": {
  "xMm": 412000,
  "yMm": 398000,
  "zMm": 0
 },
 "milestones": [
  {
   "atProgressMilli": 25000,
   "label": "milestone.shaped"
  },
  {
   "atProgressMilli": 100000,
   "label": "milestone.finished",
   "committedEventType": "action.completed"
  }
 ],
 "animationCue": "cue.craft.loop",
 "soundCue": "cue.craft.tap"
}
